{
	"$schema": "https://json-schema.org/draft/2020-12/schema",
	"$id": "https://flixer.dev/schemas/plugin-manifest-v1.json",
	"type": "object",
	"additionalProperties": false,
	"required": [
		"manifestVersion",
		"id",
		"name",
		"version",
		"description",
		"author",
		"license",
		"compatibility",
		"targets",
		"capabilities",
		"permissions"
	],
	"properties": {
		"manifestVersion": {
			"const": 1
		},
		"id": {
			"type": "string",
			"pattern": "^[a-z0-9]+(?:[.-][a-z0-9]+)*$",
			"maxLength": 128
		},
		"name": {
			"type": "string",
			"minLength": 1,
			"maxLength": 100
		},
		"version": {
			"type": "string",
			"pattern": "^(0|[1-9][0-9]*)\\.(0|[1-9][0-9]*)\\.(0|[1-9][0-9]*)(?:-[0-9A-Za-z.-]+)?(?:\\+[0-9A-Za-z.-]+)?$"
		},
		"description": {
			"type": "string",
			"minLength": 1,
			"maxLength": 1000
		},
		"author": {
			"type": "string",
			"minLength": 1,
			"maxLength": 200
		},
		"license": {
			"type": "string",
			"minLength": 1,
			"maxLength": 100
		},
		"homepage": {
			"type": "string",
			"maxLength": 2048
		},
		"icon": {
			"$ref": "#/$defs/packagePath"
		},
		"compatibility": {
			"type": "object",
			"additionalProperties": false,
			"required": [
				"pluginApi"
			],
			"properties": {
				"pluginApi": {
					"type": "string",
					"minLength": 1,
					"maxLength": 128
				},
				"flixer": {
					"type": "string",
					"minLength": 1,
					"maxLength": 128
				},
				"flixer-indexer": {
					"type": "string",
					"minLength": 1,
					"maxLength": 128
				},
				"flixer-streamer": {
					"type": "string",
					"minLength": 1,
					"maxLength": 128
				},
				"flixer-web": {
					"type": "string",
					"minLength": 1,
					"maxLength": 128
				}
			}
		},
		"targets": {
			"type": "object",
			"minProperties": 1,
			"additionalProperties": false,
			"properties": {
				"flixer": {
					"$ref": "#/$defs/target"
				},
				"flixer-indexer": {
					"$ref": "#/$defs/target"
				},
				"flixer-streamer": {
					"$ref": "#/$defs/target"
				},
				"flixer-web": {
					"$ref": "#/$defs/target"
				}
			}
		},
		"capabilities": {
			"type": "array",
			"minItems": 1,
			"uniqueItems": true,
			"items": {
				"type": "string",
				"pattern": "^[a-z][a-z0-9]*(?:[.-][a-z0-9]+)*$",
				"maxLength": 128
			}
		},
		"permissions": {
			"type": "array",
			"uniqueItems": true,
			"items": {
				"type": "string",
				"pattern": "^[a-z][a-z0-9]*(?:[.-][a-z0-9]+)*$",
				"maxLength": 128
			}
		},
		"dependencies": {
			"$ref": "#/$defs/dependencies"
		},
		"optionalDependencies": {
			"$ref": "#/$defs/dependencies"
		},
		"settingsSchema": {
			"$ref": "#/$defs/packagePath"
		},
		"database": {
			"type": "object",
			"additionalProperties": false,
			"required": [
				"tables"
			],
			"properties": {
				"tables": {
					"type": "object",
					"minProperties": 1,
					"maxProperties": 16,
					"propertyNames": {
						"pattern": "^[a-z][a-z0-9_]{0,40}$"
					},
					"additionalProperties": {
						"$ref": "#/$defs/table"
					}
				}
			}
		},
		"schedules": {
			"type": "array",
			"maxItems": 8,
			"items": {
				"type": "object",
				"additionalProperties": false,
				"required": [
					"operation",
					"intervalSeconds"
				],
				"properties": {
					"operation": {
						"type": "string",
						"pattern": "^[a-z][a-z0-9-]{0,63}$"
					},
					"intervalSeconds": {
						"type": "integer",
						"minimum": 60,
						"maximum": 86400
					}
				}
			}
		},
		"ui": {
			"type": "object",
			"additionalProperties": false,
			"properties": {
				"pages": {
					"type": "array",
					"maxItems": 8,
					"items": {
						"type": "object",
						"additionalProperties": false,
						"required": [
							"id",
							"title"
						],
						"properties": {
							"id": {
								"type": "string",
								"pattern": "^[a-z0-9]+(?:-[a-z0-9]+)*$",
								"maxLength": 64
							},
							"title": {
								"type": "string",
								"minLength": 1,
								"maxLength": 60
							},
							"nav": {
								"enum": [
									"main"
								]
							},
							"adminOnly": {
								"type": "boolean"
							}
						}
					}
				}
			}
		}
	},
	"$defs": {
		"packagePath": {
			"type": "string",
			"minLength": 1,
			"maxLength": 512,
			"pattern": "^(?!/)(?!.*(?:^|/)\\.\\.(?:/|$))(?!.*\\\\)[A-Za-z0-9._/-]+$"
		},
		"table": {
			"type": "object",
			"additionalProperties": false,
			"required": [
				"columns"
			],
			"properties": {
				"columns": {
					"type": "object",
					"minProperties": 1,
					"maxProperties": 64,
					"propertyNames": {
						"pattern": "^[a-z][a-z0-9_]{0,40}$"
					},
					"additionalProperties": {
						"type": "object",
						"additionalProperties": false,
						"required": [
							"type"
						],
						"properties": {
							"type": {
								"enum": [
									"text",
									"integer",
									"boolean",
									"timestamp",
									"json",
									"uuid"
								]
							},
							"primary": {
								"type": "boolean"
							},
							"nullable": {
								"type": "boolean"
							},
							"default": {
								"oneOf": [
									{
										"type": "string",
										"maxLength": 200
									},
									{
										"type": "number"
									},
									{
										"type": "boolean"
									},
									{
										"type": "null"
									}
								]
							}
						}
					}
				},
				"indexes": {
					"type": "array",
					"maxItems": 16,
					"items": {
						"type": "object",
						"additionalProperties": false,
						"required": [
							"columns"
						],
						"properties": {
							"columns": {
								"type": "array",
								"minItems": 1,
								"maxItems": 4,
								"items": {
									"type": "string",
									"pattern": "^[a-z][a-z0-9_]{0,40}$"
								}
							},
							"unique": {
								"type": "boolean"
							}
						}
					}
				}
			}
		},
		"target": {
			"type": "object",
			"additionalProperties": false,
			"required": [
				"entry"
			],
			"properties": {
				"entry": {
					"$ref": "#/$defs/packagePath"
				}
			}
		},
		"dependencies": {
			"type": "object",
			"propertyNames": {
				"pattern": "^[a-z0-9]+(?:[.-][a-z0-9]+)*$"
			},
			"additionalProperties": {
				"type": "string",
				"minLength": 1,
				"maxLength": 128
			}
		}
	}
}